[
  {
    "asset_link_id": "ALNK-OKTA-PROD-001",
    "control_id": "CTRL-IAM-ACCESS-REVIEW-001",
    "asset_type": "service",
    "asset_ref": "okta:production-tenant:acme-corp",
    "tenant_id": "acme-corp",
    "in_scope": true,
    "established_at": "2026-01-15T09:00:00Z",
    "owner_role": "ciso",
    "notes": "Primary identity provider; quarterly access review runs against Okta groups + privileged-access roles. Evidence emits via Okta API."
  },
  {
    "asset_link_id": "ALNK-LEGACY-AS400-001",
    "control_id": "CTRL-IAM-ACCESS-REVIEW-001",
    "asset_type": "system",
    "asset_ref": "datacentre:legacy:as400-payroll",
    "tenant_id": "acme-corp",
    "in_scope": false,
    "scope_rationale": "Legacy AS/400 payroll system is being decommissioned by 2026-12-31. Compensating control: monthly manual access review by HR head (EXC-2026-0002 documents the time-bounded waiver).",
    "established_at": "2025-06-01T00:00:00Z",
    "expires_at": "2026-12-31T23:59:59Z",
    "owner_role": "ciso"
  },
  {
    "asset_link_id": "ALNK-EU-DATA-RESIDENCY-001",
    "control_id": "CTRL-DATA-RESIDENCY-EU-001",
    "asset_type": "region",
    "asset_ref": "cloudflare:wnam:eu-central",
    "tenant_id": "acme-corp",
    "in_scope": true,
    "established_at": "2026-03-01T00:00:00Z",
    "owner_role": "dpo",
    "notes": "EU-resident customer data lives in eu-central R2 bucket + Hyperdrive read-replica. Tested via residency-conformance suite."
  }
]
